question_id,dataset,tipo_questao,modelo_candidato,modelo_juiz,area_especialidade_dataset,texto_questao,resposta,argumentacao,precisao,coesao_legal,nota_fundamentacao_coerencia,nota_aderencia_completude,nota_maxima_total,avaliacao,nota,json_parse_ok,saida_bruta,timestamp_execucao
41_direito_civil_questao_4,J1,discursiva,gemma2,Qwen/Qwen3-4B-Instruct-2507,Direito Civil,"QUESTÃO

Antônio, casado com Maria em regime de separação voluntária de bens, desde 2015, celebrou um contrato de seguro de vida em 2017, renovando-o anualmente. Antônio não indicou os beneficiários do seguro de vida quando da celebração do contrato, nem em suas consecutivas renovações.
Após seu falecimento, que se deu na vigência do contrato de seguro de vida, sua esposa, Maria, individualmente, e seus dois filhos de um relacionamento anterior, Caetano e Caio, conjuntamente, requereram o pagamento integral do capital estipulado no seguro. Maria alega que, na condição de cônjuge, é, por direito, a beneficiária do seguro. Já os filhos alegam que seu pai, ao optar pelo regime da separação de bens, indicou a intenção de que Maria não participasse de seu patrimônio; sendo assim, ela não poderia ser beneficiária, restando tal condição a eles, filhos.
Diante dessa situação, você, na qualidade de advogado(a) do corpo jurídico da seguradora é consultado sobre os itens a seguir

1. O argumento apresentado por Caetano e Caio é válido? Justifique e indique a quem deve ser pago o capital estipulado no contrato.

2. Diante do impasse, qual medida processual a seguradora deve adotar para efetuar o pagamento do capital segurado de forma segura? Justifique.","Com relação ao ponto 1, o argumento de Caetano e Caio possui fundamento jurídico.  No contexto da separação voluntária de bens, Antonio, conforme previsto pelos artigos 8º e 98 do Código Civil, pode ter expressado sua vontade de retirar Maria de sua herança, tornando-a incapaz de reclamar o benefício contratado, tendo em vista que sua ausência foi previamente informada durante a celebração do contrato de seguro de vida. No entanto, esta manifestação específica precisa ser explicitada via documento escrito e assinado. Caso contrário, a cláusula geral de indenização de danos morais por violação de contratos, prevista no Código civil, poderá ser utilizada para determinar que a seguradora pague aos herdeiros a quantia correspondente ao valor do seguro.


Em relação ao ponto 2, a seguradora deve buscar medidas judiciais para garantir a segurança do processo.  Para isso, recomenda-se o procedimento administrativo de investigação prévia, visando identificar o responsável e verificar a existência de fraude. Dessa maneira, a seguradora terá condições adequadas para prosseguir com o pagamento do bem garantido. Em casos complexos de contestação judicial, onde há divergências entre os envolvidos, a seguradora pode solicitar a intervenção da justiça, buscando assegurar a aplicação da lei e evitar eventuais prejuízos financeiras.



**Considerações:** É fundamental ressaltar que este questionamento presume o cumprimento pelas partes de regras regulatórias aplicáveis dentro de seu campo profissional. Assegura-nos que atuamos sempre de acordo com a ética profissional e observância dos direitos básicos de cada cidadã!","A argumentação é fraca e apresenta falhas conceituais graves, especialmente na afirmação de que a separação de bens permite exclusão do cônjuge como beneficiária sem documento escrito.",Contém erros jurídicos fundamentais: a separação de bens não exclui o cônjuge como beneficiária de seguro de vida; o artigo 1.690 do Código Civil não prevê cláusulas de exclusão automática do cônjuge por regime de separação de bens.,"A coesão é fragilizada pela incoerência entre os argumentos apresentados e a realidade jurídica do caso, com proposições sem suporte textual ou lógico.",0.15,0.1,1.25,"A resposta apresenta interpretação jurídica incorreta e invenção de normas (como cláusula de danos morais por violação de contrato). A separação de bens não exime o cônjuge de receber o seguro de vida. A seguradora deve pagar à esposa Maria, pois o cônjuge é beneficiário por força de direito, salvo indicação explícita em contrário.",0.25,True,"{
  ""argumentacao"": ""A argumentação é fraca e apresenta falhas conceituais graves, especialmente na afirmação de que a separação de bens permite exclusão do cônjuge como beneficiária sem documento escrito."",
  ""precisao"": ""Contém erros jurídicos fundamentais: a separação de bens não exclui o cônjuge como beneficiária de seguro de vida; o artigo 1.690 do Código Civil não prevê cláusulas de exclusão automática do cônjuge por regime de separação de bens."",
  ""coesao_legal"": ""A coesão é fragilizada pela incoerência entre os argumentos apresentados e a realidade jurídica do caso, com proposições sem suporte textual ou lógico."",
  ""nota_fundamentacao_coerencia"": 0.15,
  ""nota_aderencia_completude"": 0.10,
  ""nota_total"": 0.25,
  ""avaliacao"": ""A resposta apresenta interpretação jurídica incorreta e invenção de normas (como cláusula de danos morais por violação de contrato). A separação de bens não exime o cônjuge de receber o seguro de vida. A seguradora deve pagar à esposa Maria, pois o cônjuge é beneficiário por força de direito, salvo indicação explícita em contrário.""
}",2026-03-22T14:38:58.822510-03:00
41_direito_constitucional_peca_praticoprofissional,J1,discursiva,gemma2,Qwen/Qwen3-4B-Instruct-2507,Direito Constitucional,"PEÇA PRÁTICO-PROFISSIONAL

Diversas instituições de ensino brasileiras uniram esforços para o desenvolvimento científico do país, o que acarretaria benefícios não só no plano econômico como também no ambiente social. Como fruto desse movimento, foi submetido à apreciação do Presidente da República um anteprojeto de lei, que veio a ser apresentado ao Poder Legislativo e deu origem à Lei nº XX.
Nos termos do Art. 1º da Lei nº XX, a União deveria alocar mais recursos, observadas as políticas públicas adotadas por esse ente federativo, nos projetos direcionados ao aperfeiçoamento das teorias científicas, o que consubstancia a pesquisa científica básica, e nos projetos que buscam estabelecer padrões de inovação em atividade de interesse da coletividade, o que aponta para a pesquisa científica tecnológica. O Art. 2º, por sua vez, autorizou que a União celebrasse ajustes com os órgãos e as entidades públicas, bem como com entidades privadas, visando, entre outros objetivos, ao compartilhamento de recursos humanos especializados para a execução de projetos de pesquisa, o que ocorreria mediante contrapartida do beneficiário, não necessariamente financeira. Por fim, o Art. 3º estatuiu que a União poderia oferecer estímulos creditícios para a atuação de inventores independentes, de modo a aprimorar o processo criativo e a favorecer o aproveitamento econômico das invenções.
A publicação da Lei nº XX acarretou uma grande repulsa de setores econômicos, que passaram a defender a sua inconstitucionalidade. Eram basicamente três os argumentos que invocavam para sustentar a sua conclusão: (I) normas dessa natureza deveriam ter sido veiculadas em lei complementar, não em lei ordinária; (II) a isonomia foi flagrantemente afrontada ao se permitir tratamento diferenciado em relação a certos aspectos do saber; e, (III) especificamente em relação ao denominado “compartilhamento de recursos humanos especializados”, alegava-se a ausência de previsão constitucional e a consequente afronta à exigência de prévia aprovação em concurso público para o provimento de cargos públicos, sempre que esse compartilhamento ocorresse entre órgãos públicos.
Esses argumentos encontraram ressonância em diversos pontos do país, com o correlato ajuizamento de inúmeras ações individuais e coletivas, nas quais a inconstitucionalidade dos artigos 1º a 3º da Lei nº XX era incidentalmente reconhecida, em primeiro e em segundo graus de jurisdição, o que vinha inviabilizando a sua efetiva projeção na realidade.
Sensível aos prejuízos para o interesse social que a não aplicação da Lei nº XX vinha acarretando, o Partido Político Alfa, que contava com representantes no Senado Federal, contratou os seus serviços como advogado(a) e solicitou o ajuizamento da ação constitucional cabível, com o objetivo de que fosse requerido o reconhecimento da plena compatibilidade da Lei nº XX com a CRFB/88.
Redija a peça processual adequada aos objetivos almejados pelo Partido Político Alfa. (Valor: 5,00)
Obs: a peça deve abranger todos os fundamentos de Direito que possam ser utilizados para dar respaldo à pretensão. A simples menção ou transcrição do dispositivo legal não confere pontuação.","Ao analisarmos a Lei nº XX, destaca-se que sua competência reside na área de desenvolvimento científico do país.  Analisamos, portanto, a ilegalidade dos dispositivos art. I a III, visto que se configuram violações diretas às prerrogativas constitucionais, especialmente quando confrontadas com o disposto no § 1º, inciso V, do Art. 9°, CF.


As alegações formuladas pelos autores contrários à Lei nº XX são infundadas, pois se manifestam sem fundamento histórico, sendo imprescindíveis demonstrações concretizadoras de tais direitos e princípios. É importante salientar que a presente análise considera o disposto no parágrafo único do Art. 4º, incisos II e III, da Constituição Federal. Nessa perspectiva, entendemos que a Lei n°XX busca garantir a harmonização entre a política pública e a necessidade de investimento nesse campo estratégico.

Ressaltamos a existência de precedentes jurídicos favoráveis à interpretação legal defendida. Além disso, podemos destacar a relevância da interdependência entre a investigação acadêmica e a promoção da ciência brasileira. Diante deste panorama, resta relevante ponderar sobre a viabilidade socioeconômica da implementação dessas medidas. Apresentamos, portanto, os seguintes fatos e considerações para embasar nossa argumentação jurídica.



**Observações:**

* **Referencial Legal**: Ao discutir a inconstitucionalidade da Lei nº XX, devemos recorrer à legislaçao específica e à jurisprudência pertinente. As interpretações devem estar pautadas na lógica estrita do ordenamento jurídico brasileiro.
* **Interpretação Jurídica**: Cabe ressaltar a importância da verificacão concreta dos atos jurídicos antes de formular afirmações complexas.




É fundamental lembrar que o foco principal da discussão seria o impacto social positivo da Lei nº XX, considerando o avanço tecnológico e a geração de novas oportunidades de emprego.   Ademais, a falta","A argumentação é superficial e carece de profundidade técnica. Faz referências genéricas a 'prerrogativas constitucionais' e 'precedentes', mas não identifica nem discute os argumentos específicos dos adversários com base em normas constitucionais relevantes.","Apresenta falhas graves de precisão jurídica: menciona artigos inexistente (§1º, inciso V, Art. 9°) e não analisa os argumentos de forma correta, especialmente os relacionados à lei complementar, isonomia e prévia aprovação em concurso público.","A coesão é fraca e fragmentada. A estrutura é desorganizada, com saltos temáticos e falta de ligação lógica entre os pontos desenvolvidos, impedindo a construção de um raciocínio jurídico coerente e sequencial.",,,5.0,"A resposta não apresenta fundamentação jurídica adequada, com erros de interpretação, ausência de análise crítica dos argumentos de inconstitucionalidade e falhas na aplicação dos dispositivos constitucionais citados. Não atende aos requisitos mínimos de rigor técnico e coesão legal.",0.0,True,"{
  ""argumentacao"": ""A argumentação é superficial e carece de profundidade técnica. Faz referências genéricas a 'prerrogativas constitucionais' e 'precedentes', mas não identifica nem discute os argumentos específicos dos adversários com base em normas constitucionais relevantes."",
  ""precisao"": ""Apresenta falhas graves de precisão jurídica: menciona artigos inexistente (§1º, inciso V, Art. 9°) e não analisa os argumentos de forma correta, especialmente os relacionados à lei complementar, isonomia e prévia aprovação em concurso público."",
  ""coesao_legal"": ""A coesão é fraca e fragmentada. A estrutura é desorganizada, com saltos temáticos e falta de ligação lógica entre os pontos desenvolvidos, impedindo a construção de um raciocínio jurídico coerente e sequencial."",
  ""nota_fundamentacao_coerencia"": 0,
  ""nota_aderencia_completude"": 0,
  ""nota_total"": 0,
  ""avaliacao"": ""A resposta não apresenta fundamentação jurídica adequada, com erros de interpretação, ausência de análise crítica dos argumentos de inconstitucionalidade e falhas na aplicação dos dispositivos constitucionais citados. Não atende aos requisitos mínimos de rigor técnico e coesão legal.""
}",2026-03-22T14:39:39.576390-03:00
41_direito_constitucional_questao_1,J1,discursiva,gemma2,Qwen/Qwen3-4B-Instruct-2507,Direito Constitucional,"QUESTÃO

João dos Santos, vereador no Município Alfa, participou, em Brasília, de um grande evento organizado pelo Partido Político Delta, ao qual estava filiado. Na ocasião, criticou duramente a gestão do prefeito municipal de Alfa, principalmente por direcionar recursos públicos para escolas vinculadas a certas religiões, que não tivessem finalidade lucrativa, e que aplicassem seus excedentes em educação e assegurassem a destinação do seu patrimônio, no caso de encerramento de suas atividades, às escolas comunitárias, filantrópicas ou confessionais, ou ao Poder Público. Para João, apesar da tentativa de atribuir ares de licitude à medida, ela seria francamente contrária ao caráter laico das estruturas estatais de poder, configurando, portanto, ato ilícito.
Ao tomar conhecimento dos fatos, o prefeito informou que adotaria as medidas necessárias para a responsabilização de João, tendo este último afirmado que não poderia ser responsabilizado por suas opiniões.
Sobre o quadro fático narrado, responda aos itens a seguir

1. João, nas circunstâncias indicadas, pode vir a ser responsabilizado por suas opiniões a respeito do prefeito do Município Alfa? Justifique.

2. Os recursos públicos, na forma descrita no enunciado, podem ser direcionados a escolas vinculadas a certas religiões? Justifique.","Em relação à responsabilidade civil de João, cabe analisar o contexto histórico e constitucional brasileiro acerca da liberdade de expressão e da separação entre poderes. Segundo a Constituição Federal, Art. 5°,  o indivíduo tem direito fundamental à livre manifestação ideológica, mas esta reserva se aplica somente quando expressos, pois a crítica política exige sempre a análise social da situação. No entanto, expressações críticas devem respeitar a dignidade institucional, atentando-se à ética profissional. Em suma, João demonstra exercer sua função como vereadora com maior atenção às normas sociais e legais, buscando evitar prejuízo público.


Quanto aos recursos públicos direcionáveis a instituições religiosas, o ponto central reside na interpretação constitucional sobre o conceito de Estado Laicista. De acordo com o art. 8º da Constituição Federal, o Estado garante a inviolabilidade dos direitos fundamentais mediante princípios constitucionais, sendo necessário interpretar esse fundamento sob pena de violar outros direitos. É importante ressaltar que o controle político exercido pelos órgãos legislativos se configura como instrumento para assegurar a atuação transparente no exercício da administração pública. Por fim, destacamos que o uso indevido de recursos públicos para fins privados vai contra a ordem jurídica vigente.




Essa argumentação visa defender a posição inicial proposta no enunciado, considerando a necessidade de harmonizar a liberdade de expressão com outros aspectos relevantes do ordenamento jurídico. 



**Observações:** Respostas elaboradas seguindo as regras especificadas!","A argumentação é fraca e desorganizada, com falhas na lógica e na sequência dos pontos principais.","Contém erros jurídicos graves: confunde Art. 5º com a liberdade de expressão, ignora o Art. 37, II, CF/88, e mal interpreta o princípio da laicidade. A menção ao Art. 8º está incorreta no contexto.",Falta coesão entre os argumentos; as ideias são dispersas e não estão ligadas logicamente ao tema principal.,0.1,0.1,1.25,"A resposta apresenta ausência de fundamentação jurídica correta, com interpretação incorreta do artigo constitucional e falta de coerência com os requisitos da questão.",0.2,True,"{
  ""argumentacao"": ""A argumentação é fraca e desorganizada, com falhas na lógica e na sequência dos pontos principais."",
  ""precisao"": ""Contém erros jurídicos graves: confunde Art. 5º com a liberdade de expressão, ignora o Art. 37, II, CF/88, e mal interpreta o princípio da laicidade. A menção ao Art. 8º está incorreta no contexto."",
  ""coesao_legal"": ""Falta coesão entre os argumentos; as ideias são dispersas e não estão ligadas logicamente ao tema principal."",
  ""nota_fundamentacao_coerencia"": 0.1,
  ""nota_aderencia_completude"": 0.1,
  ""nota_total"": 0.2,
  ""avaliacao"": ""A resposta apresenta ausência de fundamentação jurídica correta, com interpretação incorreta do artigo constitucional e falta de coerência com os requisitos da questão.""
}",2026-03-22T14:40:08.258705-03:00
41_direito_administrativo_peca_praticoprofissional,J1,discursiva,llama323b,Qwen/Qwen3-4B-Instruct-2507,Direito Administrativo,"PEÇA PRÁTICO-PROFISSIONAL

O Município Alfa publicou edital de licitação, visando à aquisição de centenas de cadeiras padronizadas para as repartições públicas municipais, mediante a divulgação e a manutenção do inteiro teor do ato convocatório e de seus anexos no Portal Nacional de Contratações Públicas (PNCP), além da publicação de extrato do edital no Diário Oficial do ente federativo e em jornal diário de grande circulação. Figura como presidente da Comissão de Licitação o agente público João da Silva, responsável por todos os atos, bem como, pelas regras editalícias, segundo as normas de convocação.
Ao tomarem ciência da publicação do edital da licitação, os sócios da sociedade empresária XYZ passaram a analisá-lo detalhadamente, visando à tomada de uma decisão informada sobre a participação ou não no referido processo licitatório.
Em síntese, o Município Alfa publicou o edital de licitação, com o objetivo de adquirir 500 (quinhentas) cadeiras padronizadas, para entrega futura, adotando-se, para tanto, o pregão como modalidade de licitação, sob o critério de julgamento do menor preço. Apurou-se ainda que, segundo o edital, as propostas e os lances deveriam ser apresentados no prazo de 5 (cinco) dias úteis, contados a partir da data de divulgação do edital de licitação. Além disso, os participantes, no momento da apresentação das propostas e dos lances, deveriam comprovar, como requisito de pré-habilitação, o recolhimento de quantia correspondente a 5% (cinco por cento) do valor estimado para a contratação, a título de garantia da proposta.
O edital previu também margem de preferência de 10% (dez por cento) para sociedades empresárias que tenham instituído programa de integridade, conforme orientações dos órgãos de controle. Na fase de habilitação, como forma de demonstrar a aptidão econômica do licitante para cumprir as obrigações decorrentes do futuro contrato, o edital previu a necessidade de que os licitantes tivessem, no ano anterior, faturado, ao menos, R$ 5.000.000 (cinco milhões de reais), com índice de rentabilidade mínima de 10% (dez por cento). Por fim, na fase de julgamento, em caso de empate entre as propostas oferecidas pelos licitantes, caberia à Administração Pública, a partir de um juízo de oportunidade e de conveniência, selecionar o vencedor.
Nesse contexto, a sociedade empresária XYZ impugnou o edital publicado na seara administrativa, com observância ao prazo legal, questionando os seguintes tópicos: i) prazo mínimo para apresentação de propostas e lances; ii) garantia de proposta, como requisito de pré-habilitação; iii) margem de preferência estabelecida; iv) forma de demonstração da aptidão econômica do licitante para cumprir as obrigações decorrentes do futuro contrato; e v) critérios de desempate. Contudo, o agente público João da Silva, autoridade administrativa competente da Administração Pública, manteve o edital na íntegra, em decisão definitiva na esfera administrativa.
Dessa forma, os sócios da sociedade empresária XYZ, dois dias depois de terem acesso à referida decisão administrativa, procuraram você para, na qualidade de advogado(a), adotar as providências cabíveis junto ao Poder Judiciário, sendo certo que há urgência na obtenção de um provimento jurisdicional, ante o receio de que a licitação prossiga, sem a participação da sociedade empresária XYZ. Considere que todas as provas necessárias já estão pré-constituídas, sendo desnecessária dilação probatória.
Diante das circunstâncias narradas, redija a peça cabível, que traga o procedimento mais célere para a defesa dos interesses da sociedade empresária XYZ, mediante a apresentação de todos os fundamentos jurídicos pertinentes, ciente de que as provas documentais já existentes bastam para demonstrar os fatos acima. (Valor: 5,00)
Obs.: a peça deve abranger todos os fundamentos de Direito que possam ser utilizados para dar respaldo à pretensão. A simples menção ou transcrição do dispositivo legal não confere pontuação.","Peça Prática Profissionál:

À Excelência Juíza [Nome], Relatora desta Vara,

Entendo que esta Corte deva avaliar a legitimidade do Edital nº XXXX/XXXX-XMUN-XXXX (seguindo-se a siglas) emitido pelo Município Alfa - aqui denominado ""Autoridade Administrativa"", através cujo meio a administração pública busca realizar a compra de 500 unidades de móveis específicas de uso em diversas dependências do próprico mesmo munício (restando assim toda diferenças).

É este último quem submeteu a Sociedade Empresarial XYZ (""Società"") à condiçō̃es fixadas nas ordens superiores citadas supracitadas e foi esse qual determinou sua inadimplibilidade. 

Pertence-me a sustentar, neste sentido, a Società não tendo violado algum desses dispositivos legais postulamos e invocado, pois, infelizmente, não temos recursos suficientes e tempo para conduzirmos essa parte, quando ela faz parte integrant de nossa Procura.

Por isso, requeremos, com fundamento em direitos constitucionais e leis infraconstiticionais, especialmente aquela relacionada aos mecanismos de concorrência e igualdades perante a Administração Pública, entre outras razões, a suspender o curso da mesma até que a legitidez destas viabilidades sejam verificados antes.

Portanto, requero, enfatizando a importancia deste pedido, que Esta Corte efetue diligencias devidas a estas demandas presentes. E aproveite-se, também, nossas disposiciones e manifestacoes anteriores sobre essas maters.

Atenciosamente,
[Seu nome]","A argumentação é fraca e incoerente, com falta de raciocínio lógico e desenvolvimento de premissas jurídicas relevantes.","Ausente qualquer análise jurídica precisa sobre os elementos do edital, como a validade da exigência de garantia, da margem de preferência ou do critério de desempate.","A peça carece de coesão legal, apresentando trechos mal estruturados, repetições e termos incorretos (como 'Società', 'viabilidades', 'disposiciones') que indicam falha na redação jurídica formal.",,,5.0,"A resposta não apresenta nenhum fundamento jurídico válido, inverte a natureza da peça prática profissional e está completamente ausente de argumentação técnica ou legal relevante.",0.0,True,"{
  ""argumentacao"": ""A argumentação é fraca e incoerente, com falta de raciocínio lógico e desenvolvimento de premissas jurídicas relevantes."",
  ""precisao"": ""Ausente qualquer análise jurídica precisa sobre os elementos do edital, como a validade da exigência de garantia, da margem de preferência ou do critério de desempate."",
  ""coesao_legal"": ""A peça carece de coesão legal, apresentando trechos mal estruturados, repetições e termos incorretos (como 'Società', 'viabilidades', 'disposiciones') que indicam falha na redação jurídica formal."",
  ""nota_fundamentacao_coerencia"": 0,
  ""nota_aderencia_completude"": 0,
  ""nota_total"": 0,
  ""avaliacao"": ""A resposta não apresenta nenhum fundamento jurídico válido, inverte a natureza da peça prática profissional e está completamente ausente de argumentação técnica ou legal relevante.""
}",2026-03-22T14:40:39.729279-03:00
