question_id,dataset,tipo_questao,modelo_candidato,modelo_juiz,area_especialidade_dataset,texto_questao,resposta,argumentacao,precisao,coesao_legal,nota_fundamentacao_coerencia,nota_aderencia_completude,nota_maxima_total,avaliacao,nota,json_parse_ok,saida_bruta,timestamp_execucao
41_direito_civil_questao_1,J1,discursiva,llama323b,Qwen/Qwen3-4B-Instruct-2507,Direito Civil,"QUESTÃO

Joaquim conduzia seu automóvel por avenida movimentada do bairro de Copacabana, no Rio de Janeiro, em velocidade acima da permitida, após consumir elevada dose de bebida alcoólica. Ao tentar desviar de outro veículo, Joaquim perdeu o controle e subiu na calçada, vindo a colidir contra um poste.
Maria, que andava pela calçada, viu o momento em que Joaquim perdeu o controle de seu automóvel e, para salvar Joana, que estava ao seu lado, empurrou-a, vindo ambas a caírem em cima da vidraça de uma loja. Na queda, quebraram o vidro e danificaram alguns itens que estavam em exibição na vitrine.
Sobre o caso narrado, responda aos itens a seguir

1. Maria praticou ato ilícito ao empurrar Joana, quebrando o vidro e danificando os itens da vitrine? Justifique.

2. Maria, uma vez demandada em Juízo pelo dono da loja para ser indenizado pelos danos sofridos, poderá provocar intervenção de terceiros? Caso afirmativo, qual a modalidade e em face de quem? Justifique.","Para resolver essa situação hipotética, vamos analisar cada parte separadamente.


Primeira Questão - Atividade Ilícita Praticada por Maria:

Em relação à primeira questão, podemos ver que Maria foi puxada nessa situação porque ela teve que agir rapidamente quando percebeu que Joachim perderia o controle com ele mesmo envolvido com consumo excessivo de álcool. Nesse cenário de alta pressa, sua reação imediata pode levar até considerações éticas sobre moralização responsável mas dentro dessa lógica existencialista de escolher entre ajudar mais algumas pessoas já colocadas em apuros físicos causadores de lesões etc., também tem argumentáveis momentos onde pode haver ilegalidades decorrentes de forças externas incontrolavelmente operantes nas relações humanas, inclusive aquela situacional aqui representada. Entenda-se bem, então, que nem sempre existe clareza e certeza total da razão de tal conduta; assim sendo, dependendo de circunstâncias específicas observadas particularmente esse tipo de atitude resultaria de intensificar os prejuízos ao proprietario desta empresa comercializada sob forma de vendas ao público através desse ambiente fixo deste negório. 

No entanto, ainda deixamos margens para justiarias sociais e/ou econômicas por exemplo de trabalhadoras vulneraveis diante de adversidades variadas. Por isso seria importante concluir finalmente que sim, podia haver casos de atividade maliciosa, desde que interpretarmos que, muitos vezes, há algum equilíbrio social implcado pelalimitacion destas consequencias fisicas e emocionais derivadas desses fatos que podem impactari muito profundamente qualidade de vida de diversas categorias populares ou marginalizadas. Em","A argumentação é fraca e carece de estrutura lógica clara, apresentando conceitos vagos e sem conexão direta com a análise jurídica exigida.","Há falhas graves de precisão jurídica: não se menciona o conceito de dolo, culpa, ou a necessidade de intenção para ato ilícito; falta referência ao artigo 1075 do Código Civil ou a outros dispositivos legais relevantes.","A coesão legal está ausente: o texto flui de forma dispersa, com transições inadequadas e sem ligação entre as ideias centrais e a estrutura jurídica exigida.",0.1,0.1,1.25,"A resposta não apresenta fundamentação jurídica adequada, com ausência de análise sobre a natureza do ato ilícito, a necessidade de dolo ou culpa, e falha em aplicar o artigo 1075 do Código Civil. A argumentação é genérica, não técnica e sem coerência jurídica.",0.2,True,"{
  ""argumentacao"": ""A argumentação é fraca e carece de estrutura lógica clara, apresentando conceitos vagos e sem conexão direta com a análise jurídica exigida."",
  ""precisao"": ""Há falhas graves de precisão jurídica: não se menciona o conceito de dolo, culpa, ou a necessidade de intenção para ato ilícito; falta referência ao artigo 1075 do Código Civil ou a outros dispositivos legais relevantes."",
  ""coesao_legal"": ""A coesão legal está ausente: o texto flui de forma dispersa, com transições inadequadas e sem ligação entre as ideias centrais e a estrutura jurídica exigida."",
  ""nota_fundamentacao_coerencia"": 0.1,
  ""nota_aderencia_completude"": 0.1,
  ""nota_total"": 0.2,
  ""avaliacao"": ""A resposta não apresenta fundamentação jurídica adequada, com ausência de análise sobre a natureza do ato ilícito, a necessidade de dolo ou culpa, e falha em aplicar o artigo 1075 do Código Civil. A argumentação é genérica, não técnica e sem coerência jurídica.""
}",2026-03-22T14:44:37.022433-03:00
41_direito_civil_questao_2,J1,discursiva,llama323b,Qwen/Qwen3-4B-Instruct-2507,Direito Civil,"QUESTÃO

O gado Nelore criado por Duarte vem sofrendo de doença desconhecida. Inocêncio, produtor rural, comprometeu-se a ajudá-lo, conseguindo que o melhor veterinário da região e também produtor rural, Matias, concordasse em visitar o rebanho de Duarte em, no máximo, três dias, em virtude da urgência da situação. Matias aceitou o compromisso, mas não compareceu em razão dos seus próprios compromissos em sua fazenda, especialmente por causa do recebimento de duas novas máquinas agrícolas. Na semana seguinte, Matias foi até a fazenda de Duarte e constatou a morte de toda a criação. Duarte, diante disso, acionou Inocêncio e Matias pleiteando indenização pelos danos sofridos.

Sobre a hipótese narrada, responda aos itens a seguir.

1. O pedido de perdas e danos em face de Inocêncio merece prosperar? Justifique.

2. Se Matias for condenado, as duas máquinas agrícolas de sua propriedade poderão ser penhoradas? Justifique.","É procedido o pedido de perdas e danos contra Inoquecio com fundamento na responsabilidade civil pelo dano causado à vida e à saúde animal deDuarte e nas consequentes mortes. 

De acordo com o Código Civil Brasileiro (artigos 186, 197 e 927) bem assim o Código Penal (Lei nº10.406/2002 - Leil 11215, artigo 229 §2°, Lei Federal Nº12.528 DE 2012, artigo 18, e §29 ), é imputável à negligencia matia ter evitado auxiliar Duarte após receber do mesmo uma convocatória dentro do tempo determinado. É possível afirmar que esta decisáo seria julgada prejudicial tanto em termos materiais quanto morais.
 
Em relação ao segundo item, Diante desta prevenção do juiz ele não será obrigado a cumprir essa penalidade prevista no Artigo 646 DO CÓDIGO DE PROCEDIMENTOS CIVIS (LEI NOVILHA 11.196/2009 - RDC 468 – artículo 8º), mediante qual a sentença pode ordenar a penhora de bens, desde que estejam provenientes de fontes outras que a renda pessoal do autor. Portanto, são legítimas e cabíveis as alegações referentes ás duas maqinas agro-colheiras.","A argumentação apresenta falhas fundamentais: não há análise coerente da responsabilidade civil por dolo ou culpa em relação a Inocêncio, e a ligação entre a convocação e a responsabilidade é equivocada.","Contém erros graves de precisão jurídica: cita artigos inexistentes (ex: art. 186, 197, 927 do CC); confunde responsabilidade civil com responsabilidade penal; menciona Lei nº10.406/2002 e Lei 12.528 sem fundamento; invoca artigo 646 do CPC sem base legal direta para penhora.","A coesão é fraca: a sequência lógica entre os pontos é desorganizada, com saltos entre temas sem conexão clara entre os elementos jurídicos apresentados.",0.1,0.1,1.25,"A resposta é insatisfatória por ausência de fundamentação jurídica correta, com erros conceituais e citatórios significativos. Não atende às exigências de precisão e coesão legal exigidas pela questão.",0.2,True,"{
  ""argumentacao"": ""A argumentação apresenta falhas fundamentais: não há análise coerente da responsabilidade civil por dolo ou culpa em relação a Inocêncio, e a ligação entre a convocação e a responsabilidade é equivocada."",
  ""precisao"": ""Contém erros graves de precisão jurídica: cita artigos inexistentes (ex: art. 186, 197, 927 do CC); confunde responsabilidade civil com responsabilidade penal; menciona Lei nº10.406/2002 e Lei 12.528 sem fundamento; invoca artigo 646 do CPC sem base legal direta para penhora."",
  ""coesao_legal"": ""A coesão é fraca: a sequência lógica entre os pontos é desorganizada, com saltos entre temas sem conexão clara entre os elementos jurídicos apresentados."",
  ""nota_fundamentacao_coerencia"": 0.1,
  ""nota_aderencia_completude"": 0.1,
  ""nota_total"": 0.2,
  ""avaliacao"": ""A resposta é insatisfatória por ausência de fundamentação jurídica correta, com erros conceituais e citatórios significativos. Não atende às exigências de precisão e coesão legal exigidas pela questão.""
}",2026-03-22T14:45:14.557738-03:00
41_direito_civil_questao_3,J1,discursiva,llama323b,Qwen/Qwen3-4B-Instruct-2507,Direito Civil,"QUESTÃO

Iara, atriz famosa por interpretar papéis de protagonista em diversas novelas, descobre que seu nome e sua imagem vêm sendo utilizados, indevidamente e sem sua autorização, por uma clínica de estética, em publicidade anunciando seus serviços.
Na publicidade em questão, constava a foto da atriz com uma frase, entre aspas, dizendo que ela só realizava procedimentos estéticos naquela clínica, por considerá-la a melhor do ramo. Ocorre que a atriz sequer conhecia a referida clínica e não havia autorizado a utilização de sua imagem.
Com receio de perder nova oportunidade de trabalho, já em fase de negociação de exclusividade, Iara procura você, como advogado(a), buscando a proibição da utilização de sua imagem pela clínica.
Diante do caso narrado, responda aos itens a seguir

1. Pode haver a proibição da utilização da imagem da atriz? Justifique.

2. Para requerer a imediata cessação da divulgação da imagem, antes de eventual sentença de mérito, qual instrumento processual é cabível? Justifique.","Para resolver esse problema, devemos primeiro analisar a situação sob aspectos legais.

Em relação ao item 1, há provabilidade de violacao da Lei nº 9.527/98 - Estatuto delito contra a saúde, pois mediante uso indevido da autoria pessoal ou representativa de outra pessoa, pode ocorrer prejuizo psicológico ou moral; alterações físicas nociva; lesões corporais graves; danos morais reais; prejudiciação financeira real; etc., inclusive inutilizar os meios de comunicação social. 

Portanto, poderia existir uma razao legal suficiente para solicitar a proibicao total e irremovivel da imagem de Iara pelo órgãoo comercial. 

Já no item 2, seria possível adotarm a medida cautelar previamente da suspensive da distribuição via mídia impressa, eletrônica, televisora e outros sistemas de informação que tenham disponibilidade pública (artigos 273-A e B do Código Civil Brasileiro).

Essa medida excepcional tem natureza liminar e antecedentes prévias decisoes judiciais e medidas oficiais que regularizessem essa situação e proporcionasse segurança adequada sobre a continuidade operacional. É importante notear também que as formas de cumprimentar esta ordem são múltiplas.","A argumentação apresenta falhas conceituais e jurídicas significativas, como a confusão entre direitos de imagem e crimes contra a saúde. A referência à Lei 9.527/98 está incorreta, pois trata de crimes contra a saúde, não de direitos de imagem.","A precisão jurídica é deficiente: a lei citada não regula o uso indevido de imagem; o direito de imagem é regulado pelo artigo 5º, inciso L, da Constituição Federal, e não por legislação específica de saúde.","A coesão legal é fraca: a resposta ignora a estrutura jurídica correta do direito de imagem e apresenta uma análise desorganizada, com falhas de lógica e falta de conexão entre os elementos jurídicos propostos.",0.15,0.15,1.25,"A resposta comete erros fundamentais de interpretação jurídica, confundindo a proteção da imagem com crimes de saúde e ignorando a base constitucional correta (CF/88, art. 5º, L). Falta qualquer referência ao direito de imagem e à necessidade de ação de proteção de imagem conforme a legislação constitucional.",0.3,True,"{
  ""argumentacao"": ""A argumentação apresenta falhas conceituais e jurídicas significativas, como a confusão entre direitos de imagem e crimes contra a saúde. A referência à Lei 9.527/98 está incorreta, pois trata de crimes contra a saúde, não de direitos de imagem."",
  ""precisao"": ""A precisão jurídica é deficiente: a lei citada não regula o uso indevido de imagem; o direito de imagem é regulado pelo artigo 5º, inciso L, da Constituição Federal, e não por legislação específica de saúde."",
  ""coesao_legal"": ""A coesão legal é fraca: a resposta ignora a estrutura jurídica correta do direito de imagem e apresenta uma análise desorganizada, com falhas de lógica e falta de conexão entre os elementos jurídicos propostos."",
  ""nota_fundamentacao_coerencia"": 0.15,
  ""nota_aderencia_completude"": 0.15,
  ""nota_total"": 0.30,
  ""avaliacao"": ""A resposta comete erros fundamentais de interpretação jurídica, confundindo a proteção da imagem com crimes de saúde e ignorando a base constitucional correta (CF/88, art. 5º, L). Falta qualquer referência ao direito de imagem e à necessidade de ação de proteção de imagem conforme a legislação constitucional.""
}",2026-03-22T14:45:55.474878-03:00
41_direito_civil_questao_4,J1,discursiva,llama323b,Qwen/Qwen3-4B-Instruct-2507,Direito Civil,"QUESTÃO

Antônio, casado com Maria em regime de separação voluntária de bens, desde 2015, celebrou um contrato de seguro de vida em 2017, renovando-o anualmente. Antônio não indicou os beneficiários do seguro de vida quando da celebração do contrato, nem em suas consecutivas renovações.
Após seu falecimento, que se deu na vigência do contrato de seguro de vida, sua esposa, Maria, individualmente, e seus dois filhos de um relacionamento anterior, Caetano e Caio, conjuntamente, requereram o pagamento integral do capital estipulado no seguro. Maria alega que, na condição de cônjuge, é, por direito, a beneficiária do seguro. Já os filhos alegam que seu pai, ao optar pelo regime da separação de bens, indicou a intenção de que Maria não participasse de seu patrimônio; sendo assim, ela não poderia ser beneficiária, restando tal condição a eles, filhos.
Diante dessa situação, você, na qualidade de advogado(a) do corpo jurídico da seguradora é consultado sobre os itens a seguir

1. O argumento apresentado por Caetano e Caio é válido? Justifique e indique a quem deve ser pago o capital estipulado no contrato.

2. Diante do impasse, qual medida processual a seguradora deve adotar para efetuar o pagamento do capital segurado de forma segura? Justifique.","Para resolver essa questão, devemos analisar as disposições legais relevantes, especialmente aquela relativa aos contratos de seguro de vida celebrados entre cônjuges sob regimes de separação de bens.

Em primeiro lugar, temos de considerar a natureza desses contratos. Artigos 236, inciso I, Código Civil Brasileiro (CCB); e §8º, Lei n°9.532/1998, regulamentaram a cláusula de ""beneficiário"". Esse último não pode deixar de ter benefício de modo algum. 

Por outro lado, conforme determinado pela justiçaria brasileira nas decisões proferidas pelos juizs de competição específica - mesmo na esfera civil, bem como também já foi definido pela Suprema Corte Federal. De acordo com esse entendimento, só podem ocorrer excepcionalidades nos casos previstos no item II e III do referencial citado acima. Portanto, tanto Maria quanto os filhos têm direito real ao valor do contrato, mas apenas aqueles cujo nome constava explicitamente junto a letra 'D' da carta, após assinar o documento.

No entanto, diante disso, podemos concluir que os fatos descritos são incompatíveis com a previsão Legal concerniente proteciondo ""Benefícios"", podendo afirmamos que ambos os filhs tenham legitimdade passiva para cobrar seus respectivos valores. Contudo, apesar isso, há ainda outras alternativas existentes. Entre elas estão algumas medidas judiciares cabazes até o final onde a sentença declaratória seja emitida.

Isso significa que precisaremos procurar alguma outra opção dentro destes termos legais antes de chegar á conclusão lógica do processo. E mais, claro, que vamos","A argumentação é fraca e carece de coerência lógica e jurídica, apresentando afirmações sem fundamento legal.","Contém erros graves de precisão jurídica: menciona artigo 236, inciso I, e §8º da Lei 9.532/1998 como fonte direta para a cláusula de beneficiário, o que está incorreto; o regime de separação de bens não exclui automaticamente a esposa como beneficiária por falta de indicação.","A coesão legal é deficiente: o texto apresenta trechos sem ligação lógica, com falhas de sequência e uso de termos equivocados (ex: 'letra D', 'justiçaria brasileira'), mostrando falta de estrutura jurídica.",0.1,0.1,1.25,"A resposta apresenta falhas fundamentais: ignora a aplicação do art. 1.690 do CC, que exige indicação explícita dos beneficiários; confunde regime de bens com direito de beneficiário; e inventa fatos (como 'letra D') sem base legal. A análise é incorreta e incoerente.",0.2,True,"{
  ""argumentacao"": ""A argumentação é fraca e carece de coerência lógica e jurídica, apresentando afirmações sem fundamento legal."",
  ""precisao"": ""Contém erros graves de precisão jurídica: menciona artigo 236, inciso I, e §8º da Lei 9.532/1998 como fonte direta para a cláusula de beneficiário, o que está incorreto; o regime de separação de bens não exclui automaticamente a esposa como beneficiária por falta de indicação."",
  ""coesao_legal"": ""A coesão legal é deficiente: o texto apresenta trechos sem ligação lógica, com falhas de sequência e uso de termos equivocados (ex: 'letra D', 'justiçaria brasileira'), mostrando falta de estrutura jurídica."",
  ""nota_fundamentacao_coerencia"": 0.1,
  ""nota_aderencia_completude"": 0.1,
  ""nota_total"": 0.2,
  ""avaliacao"": ""A resposta apresenta falhas fundamentais: ignora a aplicação do art. 1.690 do CC, que exige indicação explícita dos beneficiários; confunde regime de bens com direito de beneficiário; e inventa fatos (como 'letra D') sem base legal. A análise é incorreta e incoerente.""
}",2026-03-22T14:46:36.141912-03:00
