question_id,dataset,tipo_questao,modelo_candidato,modelo_juiz,area_especialidade_dataset,texto_questao,resposta,argumentacao,precisao,coesao_legal,nota_fundamentacao_coerencia,nota_aderencia_completude,nota_maxima_total,avaliacao,nota,json_parse_ok,saida_bruta,timestamp_execucao
41_direito_administrativo_peca_praticoprofissional,J1,discursiva,gemma2,Qwen/Qwen3-4B-Instruct-2507,Direito Administrativo,"PEÇA PRÁTICO-PROFISSIONAL

O Município Alfa publicou edital de licitação, visando à aquisição de centenas de cadeiras padronizadas para as repartições públicas municipais, mediante a divulgação e a manutenção do inteiro teor do ato convocatório e de seus anexos no Portal Nacional de Contratações Públicas (PNCP), além da publicação de extrato do edital no Diário Oficial do ente federativo e em jornal diário de grande circulação. Figura como presidente da Comissão de Licitação o agente público João da Silva, responsável por todos os atos, bem como, pelas regras editalícias, segundo as normas de convocação.
Ao tomarem ciência da publicação do edital da licitação, os sócios da sociedade empresária XYZ passaram a analisá-lo detalhadamente, visando à tomada de uma decisão informada sobre a participação ou não no referido processo licitatório.
Em síntese, o Município Alfa publicou o edital de licitação, com o objetivo de adquirir 500 (quinhentas) cadeiras padronizadas, para entrega futura, adotando-se, para tanto, o pregão como modalidade de licitação, sob o critério de julgamento do menor preço. Apurou-se ainda que, segundo o edital, as propostas e os lances deveriam ser apresentados no prazo de 5 (cinco) dias úteis, contados a partir da data de divulgação do edital de licitação. Além disso, os participantes, no momento da apresentação das propostas e dos lances, deveriam comprovar, como requisito de pré-habilitação, o recolhimento de quantia correspondente a 5% (cinco por cento) do valor estimado para a contratação, a título de garantia da proposta.
O edital previu também margem de preferência de 10% (dez por cento) para sociedades empresárias que tenham instituído programa de integridade, conforme orientações dos órgãos de controle. Na fase de habilitação, como forma de demonstrar a aptidão econômica do licitante para cumprir as obrigações decorrentes do futuro contrato, o edital previu a necessidade de que os licitantes tivessem, no ano anterior, faturado, ao menos, R$ 5.000.000 (cinco milhões de reais), com índice de rentabilidade mínima de 10% (dez por cento). Por fim, na fase de julgamento, em caso de empate entre as propostas oferecidas pelos licitantes, caberia à Administração Pública, a partir de um juízo de oportunidade e de conveniência, selecionar o vencedor.
Nesse contexto, a sociedade empresária XYZ impugnou o edital publicado na seara administrativa, com observância ao prazo legal, questionando os seguintes tópicos: i) prazo mínimo para apresentação de propostas e lances; ii) garantia de proposta, como requisito de pré-habilitação; iii) margem de preferência estabelecida; iv) forma de demonstração da aptidão econômica do licitante para cumprir as obrigações decorrentes do futuro contrato; e v) critérios de desempate. Contudo, o agente público João da Silva, autoridade administrativa competente da Administração Pública, manteve o edital na íntegra, em decisão definitiva na esfera administrativa.
Dessa forma, os sócios da sociedade empresária XYZ, dois dias depois de terem acesso à referida decisão administrativa, procuraram você para, na qualidade de advogado(a), adotar as providências cabíveis junto ao Poder Judiciário, sendo certo que há urgência na obtenção de um provimento jurisdicional, ante o receio de que a licitação prossiga, sem a participação da sociedade empresária XYZ. Considere que todas as provas necessárias já estão pré-constituídas, sendo desnecessária dilação probatória.
Diante das circunstâncias narradas, redija a peça cabível, que traga o procedimento mais célere para a defesa dos interesses da sociedade empresária XYZ, mediante a apresentação de todos os fundamentos jurídicos pertinentes, ciente de que as provas documentais já existentes bastam para demonstrar os fatos acima. (Valor: 5,00)
Obs.: a peça deve abranger todos os fundamentos de Direito que possam ser utilizados para dar respaldo à pretensão. A simples menção ou transcrição do dispositivo legal não confere pontuação.","Considerada a irregularidade presente no edital da licitação municipal, imprescindível a análise do alegado descumprimento expresso pelo órgão administrativo. Em face dessa situação, cabe destacar a relevância da ilegalidade praticada pelo agente público, considerando a atuação abusiva, tendo em vista que foi feita a alteração unilateral, sem amparo técnico adequado,  e contrariando a preservação do interesse público. Como consequência, a ação judicial precisa ser instaurada, buscando a retificação do erro cometido. A legitimidade da posição jurídica exige a aplicação do princípio da legalidade, evitando assim a perpetuação da irregularidade. No entanto, esta argumentação se torna inviável quando se reconhece a ausência de fundamento normativo suficiente para justificar a interpretação contraria, visto que o conteúdo do edital possui sentido claro. Portanto, buscamos garantir a justiça, assegurando a transparência e a igualdade de condições para os demais interessados.


É fundamental ressaltar que a parte autora poderá pleitear, em sede judicial, a revisão do EDITAL, garantindo a conformidade normativa e a imparcialidade administrativa, pois o argumento central reside no fato de que o Edital careça de fundamentação legal adequada. Nesse sentido, requeremos a intervenção judicial para evitar a continuidade da prática ilícita.



**Observação:** Esta resposta trata unicamente das falhas presentes no edital e não expõe nenhuma outra possível contestação. É importante salientar que a falta de elementos concretizadores pode prejudicar a análise do tema. A sua estratégia jurídica dependerá de diversos aspectos, incluindo o sistema jurídico vigente e a existência de outros argumentos relevantes.","A argumentação é fraca e genérica, carecendo de análise específica sobre cada cláusula do edital contestada.","Há ausência de aplicações corretas e específicas da legislação da Lei 8.666/1993, especialmente nos pontos de pré-habilitação, margem de preferência e critérios de desempate.","A coesão é limitada, com lacunas entre os argumentos e a estrutura jurídica exigida, não havendo ligação clara entre os dispositivos legais e as falhas identificadas.",,,5.0,"A resposta não analisa com rigor as cláusulas do edital conforme exigido, não cita normas específicas e ignora a necessidade de fundamentação técnica para cada ponto contestado, resultando em ausência de coerência jurídica e inadecuada aferição da legalidade.",1.5,True,"{
  ""argumentacao"": ""A argumentação é fraca e genérica, carecendo de análise específica sobre cada cláusula do edital contestada."",
  ""precisao"": ""Há ausência de aplicações corretas e específicas da legislação da Lei 8.666/1993, especialmente nos pontos de pré-habilitação, margem de preferência e critérios de desempate."",
  ""coesao_legal"": ""A coesão é limitada, com lacunas entre os argumentos e a estrutura jurídica exigida, não havendo ligação clara entre os dispositivos legais e as falhas identificadas."",
  ""nota_fundamentacao_coerencia"": 1.5,
  ""nota_aderencia_completude"": null,
  ""nota_total"": 1.5,
  ""avaliacao"": ""A resposta não analisa com rigor as cláusulas do edital conforme exigido, não cita normas específicas e ignora a necessidade de fundamentação técnica para cada ponto contestado, resultando em ausência de coerência jurídica e inadecuada aferição da legalidade.""
}",2026-03-22T14:33:22.788266-03:00
41_direito_administrativo_questao_1,J1,discursiva,gemma2,Qwen/Qwen3-4B-Instruct-2507,Direito Administrativo,"QUESTÃO

Esglobênia, servidora pública federal estável, acreditava ter preenchido os respectivos requisitos do Regime Próprio de Previdência no cargo que ocupava, razão pela qual pleiteou e obteve, junto ao órgão de origem, a aposentadoria voluntária.
Ato contínuo, o processo foi encaminhado ao Tribunal de Contas da União, o qual verificou algumas inconsistências no deferimento do pedido, de modo que está tendente a negar o registro da aposentadoria, sendo certo que o processo chegou na Corte de Contas há apenas um ano.
Diante dessa situação hipotética, responda como advogado(a), fundamentadamente, aos questionamentos a seguir

1. O ato aposentadoria de Esglobênia estava perfeito, ou seja, completou o seu ciclo de formação, antes do pronunciamento da Corte de Contas? Justifique.

2. Para negar o registro da aposentadoria de Esglobênia, o Tribunal de Contas precisa observar a ampla defesa e o contraditório? Justifique.","Em relação à primeira pergunta, cabe analisar se o Ato Aposentadoryo realizado por Esgobênia cumpriu com todos os requisitos legais para sua efetividade.  É fundamental ressaltar que a aposentadoria voluntária segue o regime próprio de previdência civil definido para servidores públicos estaduais, conforme artigo X da Lei nº 8.294/91. No entanto, exige-se que o servidor tenha efetuado as ações previstas pelo Decreto nº 3.811/96. Essa norma estabelece regras específicas sobre aplicação das normas regulatórias, inclusive a necessidade de comprovação da existência de créditos acumulados durante o tempo trabalhado. Em suma, considerando o contexto específico, o processo judicial envolvido pode resultar em decisão diversa daquela inicialmente esperada.


Quanto à segunda pergunta, é preciso entender a natureza procedural da ação proposta. Como já citado anteriormente, o Ato Administrativo do Tribunal de Contas possui caráter administrativo, portanto, exige análise prévia.  Essa análise visa verificar se houve violação legislativa e constitucional, bem como se foram respeitadas as etapas necessárias para a regularidade do procedimento administrativo. Devemos reconhecer que o sistema judiciário brasileiro prioriza a preservação de direitos humanos, independentemente do resultado final judicial.","A argumentação apresentada é fraca e inadequada, com falta de foco nos pontos centrais da questão.","Há erros graves de precisão jurídica: a referência ao artigo X da Lei 8.294/91 é incorreta, pois essa lei trata de previdência social, não de servidores públicos; o Decreto 3.811/96 não regula a aposentadoria voluntária de servidores federais; o RPPS é o regime correto, não o de servidores estaduais.","A coesão legal é insuficiente: a resposta não desenvolve com clareza nem a primeira nem a segunda questão, apresentando afirmações genéricas sem ligação direta com a estrutura jurídica exigida.",0.1,0.1,1.25,"A resposta carece de fundamentação jurídica correta, com invenções de normas e falhas conceituais graves. Não atende às exigências de precisão e coerência jurídica do tema.",0.2,True,"{
  ""argumentacao"": ""A argumentação apresentada é fraca e inadequada, com falta de foco nos pontos centrais da questão."",
  ""precisao"": ""Há erros graves de precisão jurídica: a referência ao artigo X da Lei 8.294/91 é incorreta, pois essa lei trata de previdência social, não de servidores públicos; o Decreto 3.811/96 não regula a aposentadoria voluntária de servidores federais; o RPPS é o regime correto, não o de servidores estaduais."",
  ""coesao_legal"": ""A coesão legal é insuficiente: a resposta não desenvolve com clareza nem a primeira nem a segunda questão, apresentando afirmações genéricas sem ligação direta com a estrutura jurídica exigida."",
  ""nota_fundamentacao_coerencia"": 0.1,
  ""nota_aderencia_completude"": 0.1,
  ""nota_total"": 0.2,
  ""avaliacao"": ""A resposta carece de fundamentação jurídica correta, com invenções de normas e falhas conceituais graves. Não atende às exigências de precisão e coerência jurídica do tema.""
}",2026-03-22T14:33:58.684750-03:00
41_direito_administrativo_questao_2,J1,discursiva,gemma2,Qwen/Qwen3-4B-Instruct-2507,Direito Administrativo,"QUESTÃO

A sociedade de economia mista federal XYZ entrou em contato com a sociedade empresária ABC, de notória especialização, que fornece serviço técnico especializado de publicidade e divulgação, visando à celebração de um contrato administrativo. Durante as tratativas, um dos representantes da estatal afirmou que, em razão da expertise da entidade ABC, seria possível a contratação direta, afastando-se a necessidade de licitação. Nesse contexto, o contrato administrativo foi celebrado sem o prévio processo licitatório. Passados alguns meses, o diretor-executivo da sociedade empresária ABC foi informado de que o órgão de controle externo da estatal estava analisando a regularidade da contratação, em razão de indícios de superfaturamento. Dessa forma, ele solicitou à sua equipe jurídica os devidos esclarecimentos sobre a temática.
Diante dessa situação hipotética, com base na legislação que dispõe sobre o estatuto jurídico da empresa pública e da sociedade de economia mista e de suas subsidiárias, responda aos itens a seguir

1. A contratação direta da sociedade empresária ABC pela sociedade de economia mista federal XYZ, no caso em tela, cumpriu as exigências legais? Justifique.

2. Caso o órgão de controle externo da estatal verifique superfaturamento na contratação, quem responderá pelo dano causado? Justifique.","A contratação direta entre a sociedade de economia mista Federal XYZ e a sociedade empresarial ABC configura violação ao regime de licitações previstas na Lei nº 8.933/94, bem como embasamentem seu funcionamento. Apesar da competência administrativa e técnica da empresa privada ABC ter sido mencionada, ela pode apresentar-se questionável, já que a própria constituição social de empresas privadas exige a estruturação da relação contratual através de processos regulares, incluindo o atendimento de requisitos específicos de abertura e prestação de contas.  Embora possua autonomia funcional dentro do conceito de autarquia, a contratação direta, portanto, carece de fundamento legal adequado.


Em tese, a responsabilidade civil sob pena de danos causados pela prática irregular pode atentar contra a legitimidade do ato, e cabe responsabilização individual do agente responsável - conforme previsto pelos artigos 2º, 1º e 6o do Código Civil Brasileiro. Em outras palavras, o descumprimento da norma jurídica implicada na conduta ilícita, devendo haver punição penal.   



É importante destacar que a análise específica para cada caso requer a consideracão detalhada dos fatos relevantes e aplicáveis a norma legal vigente, buscando a maior precisão, garantindo segurança legal.","A argumentação é fraca e desorganizada, com falhas na lógica e na sequência dos raciocínios jurídicos.","Contém erros graves de fundamentação jurídica: cita a Lei 8.933/94 (CLT), mas a legislação de referência é a Lei 8.666/1993 (CLC). Além disso, confunde a contratação direta com exigências de autarquias e não aplica corretamente o artigo 7º, inciso II, da CLC.","Falta coesão entre os pontos desenvolvidos; há rupturas lógicas entre as premissas e as conclusões, especialmente na transição entre a análise da legalidade e a responsabilidade civil.",0.15,0.1,1.25,"A resposta apresenta erros fundamentais de interpretação jurídica, como a confusão entre CLC e CLT, e falta de alinhamento com a legislação vigente sobre contratação direta em sociedades de economia mista. Não demonstra conhecimento preciso sobre os critérios de validade da contratação direta e sobre a responsabilidade por superfaturamento.",0.25,True,"{
  ""argumentacao"": ""A argumentação é fraca e desorganizada, com falhas na lógica e na sequência dos raciocínios jurídicos."",
  ""precisao"": ""Contém erros graves de fundamentação jurídica: cita a Lei 8.933/94 (CLT), mas a legislação de referência é a Lei 8.666/1993 (CLC). Além disso, confunde a contratação direta com exigências de autarquias e não aplica corretamente o artigo 7º, inciso II, da CLC."",
  ""coesao_legal"": ""Falta coesão entre os pontos desenvolvidos; há rupturas lógicas entre as premissas e as conclusões, especialmente na transição entre a análise da legalidade e a responsabilidade civil."",
  ""nota_fundamentacao_coerencia"": 0.15,
  ""nota_aderencia_completude"": 0.10,
  ""nota_total"": 0.25,
  ""avaliacao"": ""A resposta apresenta erros fundamentais de interpretação jurídica, como a confusão entre CLC e CLT, e falta de alinhamento com a legislação vigente sobre contratação direta em sociedades de economia mista. Não demonstra conhecimento preciso sobre os critérios de validade da contratação direta e sobre a responsabilidade por superfaturamento.""
}",2026-03-22T14:34:39.804955-03:00
41_direito_administrativo_questao_3,J1,discursiva,gemma2,Qwen/Qwen3-4B-Instruct-2507,Direito Administrativo,"QUESTÃO

Determinada organização da sociedade civil tem, entre as suas principais atribuições, o desenvolvimento de projetos voltados para a alimentação saudável de crianças em idade escolar.
Após aprofundado estudo, a entidade elaborou uma proposta que acredita ser de grande interesse para o Poder Público. Assim, deseja apresentá-la, a fim de que a Administração avalie a possibilidade de realizar um chamamento público para estabelecer uma parceria com fulcro na Lei nº 13.019/2014.
Em razão disso, os representantes da mencionada organização da sociedade civil buscaram sua assessoria jurídica para dirimir as dúvidas a seguir

1. Qual é o instrumento previsto na norma em comento que viabiliza a apresentação da proposta pretendida pela mencionada organização da sociedade civil? Justifique.

2. A organização da sociedade civil ficaria impedida de participar de eventual chamamento público que venha a ser realizado a partir de sua proposta? Justifique.","Diante da análise, constata-se que a  Lei nº 13.019/2014 dispõe sobre a criação de parcerias no âmbito federal, visando promover ações sociais de impacto social, especialmente no campo da saúde pública. Em consonância com este fundamento, o disposto no art. 8º da Lei n° 13.019/2014 permite a realização de convênios com entidades privadas, mas somente quando houver demonstrado benefício nacional, bem assim,  apresentação clara e estruturada de propostas claras e assertivas. Entretanto, é importante ressaltar que a presente lei não prevê mecanismos específicos para a execução de chamamentos públicos, sendo necessário observar outros dispositivos legais, a saber, a Lei nº 8.487/92, que regulamenta a administração pública e as normas administrativas relacionadas aos procedimentos internos, como a Resolução Normativa nº 22, de 2020, que define o processo de licitação para compra ou venda de bens e serviços por parte do setor público.


Assim, considerando que a  organização da sociedade civil busca colaborar com o poder público através de parcerias, ela pode apresentar sua proposta dentro de tais parâmetros, desde que cumpra com as exigências legais, conforme estabelecidas no Decreto nº 7.428/2011, que trata da modalidade de Contrato Administrativo. Essa relação de colaboraçao pode auxiliar na concretização de objetivos compartilhados. 



Nesse sentido, a organização terá acesso à oportunidade de apresentar sua proposta, mediante adequação às regras hierárquicas e normativos descritos nas leis citadas, inclusive, garantindo transparência e conformidade administrativa. É fundamental verificar detalhadamente as disposições da legislação vigente, incluindo a previsão específica sobre o procedimento administrativo adequado para cada tipo de contrato.","A argumentação apresenta uma estrutura básica, mas carece de profundidade técnica e de foco direto nos elementos solicitados.","Contém erros jurídicos significativos: a Lei 13.019/2014 não prevê 'chamamentos públicos' nem exige 'demonstração de benefício nacional' como condição para convênio; o artigo 8º autoriza convênios, mas não menciona 'proposta clara e assertiva'.","A coesão está presente, mas a ligação entre os pontos da pergunta e a resposta é fraca e desorganizada, com falhas na sequência lógica dos raciocínios.",0.25,0.3,1.25,"A resposta apresenta falhas graves de precisão jurídica ao interpretar erradamente a Lei 13.019/2014, ignorando o dispositivo específico sobre chamamento público e a natureza do instrumento jurídico previsto. Faltam fundamentações diretas sobre o instrumento de apresentação de proposta e a capacidade de participação da sociedade civil.",0.55,True,"{
  ""argumentacao"": ""A argumentação apresenta uma estrutura básica, mas carece de profundidade técnica e de foco direto nos elementos solicitados."",
  ""precisao"": ""Contém erros jurídicos significativos: a Lei 13.019/2014 não prevê 'chamamentos públicos' nem exige 'demonstração de benefício nacional' como condição para convênio; o artigo 8º autoriza convênios, mas não menciona 'proposta clara e assertiva'."",
  ""coesao_legal"": ""A coesão está presente, mas a ligação entre os pontos da pergunta e a resposta é fraca e desorganizada, com falhas na sequência lógica dos raciocínios."",
  ""nota_fundamentacao_coerencia"": 0.25,
  ""nota_aderencia_completude"": 0.30,
  ""nota_total"": 0.55,
  ""avaliacao"": ""A resposta apresenta falhas graves de precisão jurídica ao interpretar erradamente a Lei 13.019/2014, ignorando o dispositivo específico sobre chamamento público e a natureza do instrumento jurídico previsto. Faltam fundamentações diretas sobre o instrumento de apresentação de proposta e a capacidade de participação da sociedade civil.""
}",2026-03-22T14:35:17.846106-03:00
