question_id,dataset,tipo_questao,modelo_candidato,modelo_juiz,area_especialidade_dataset,texto_questao,resposta,argumentacao,precisao,coesao_legal,nota_fundamentacao_coerencia,nota_aderencia_completude,nota_maxima_total,avaliacao,nota,json_parse_ok,saida_bruta,timestamp_execucao
41_direito_constitucional_peca_praticoprofissional,J1,discursiva,llama323b,Qwen/Qwen3-4B-Instruct-2507,Direito Constitucional,"PEÇA PRÁTICO-PROFISSIONAL

Diversas instituições de ensino brasileiras uniram esforços para o desenvolvimento científico do país, o que acarretaria benefícios não só no plano econômico como também no ambiente social. Como fruto desse movimento, foi submetido à apreciação do Presidente da República um anteprojeto de lei, que veio a ser apresentado ao Poder Legislativo e deu origem à Lei nº XX.
Nos termos do Art. 1º da Lei nº XX, a União deveria alocar mais recursos, observadas as políticas públicas adotadas por esse ente federativo, nos projetos direcionados ao aperfeiçoamento das teorias científicas, o que consubstancia a pesquisa científica básica, e nos projetos que buscam estabelecer padrões de inovação em atividade de interesse da coletividade, o que aponta para a pesquisa científica tecnológica. O Art. 2º, por sua vez, autorizou que a União celebrasse ajustes com os órgãos e as entidades públicas, bem como com entidades privadas, visando, entre outros objetivos, ao compartilhamento de recursos humanos especializados para a execução de projetos de pesquisa, o que ocorreria mediante contrapartida do beneficiário, não necessariamente financeira. Por fim, o Art. 3º estatuiu que a União poderia oferecer estímulos creditícios para a atuação de inventores independentes, de modo a aprimorar o processo criativo e a favorecer o aproveitamento econômico das invenções.
A publicação da Lei nº XX acarretou uma grande repulsa de setores econômicos, que passaram a defender a sua inconstitucionalidade. Eram basicamente três os argumentos que invocavam para sustentar a sua conclusão: (I) normas dessa natureza deveriam ter sido veiculadas em lei complementar, não em lei ordinária; (II) a isonomia foi flagrantemente afrontada ao se permitir tratamento diferenciado em relação a certos aspectos do saber; e, (III) especificamente em relação ao denominado “compartilhamento de recursos humanos especializados”, alegava-se a ausência de previsão constitucional e a consequente afronta à exigência de prévia aprovação em concurso público para o provimento de cargos públicos, sempre que esse compartilhamento ocorresse entre órgãos públicos.
Esses argumentos encontraram ressonância em diversos pontos do país, com o correlato ajuizamento de inúmeras ações individuais e coletivas, nas quais a inconstitucionalidade dos artigos 1º a 3º da Lei nº XX era incidentalmente reconhecida, em primeiro e em segundo graus de jurisdição, o que vinha inviabilizando a sua efetiva projeção na realidade.
Sensível aos prejuízos para o interesse social que a não aplicação da Lei nº XX vinha acarretando, o Partido Político Alfa, que contava com representantes no Senado Federal, contratou os seus serviços como advogado(a) e solicitou o ajuizamento da ação constitucional cabível, com o objetivo de que fosse requerido o reconhecimento da plena compatibilidade da Lei nº XX com a CRFB/88.
Redija a peça processual adequada aos objetivos almejados pelo Partido Político Alfa. (Valor: 5,00)
Obs: a peça deve abranger todos os fundamentos de Direito que possam ser utilizados para dar respaldo à pretensão. A simples menção ou transcrição do dispositivo legal não confere pontuação.","Peças Processuais:

Em nome do Sr. [Nome], membro do partido político Alpha,
Representante do senhor sr., solicita à Vossa Excelentez thiss Honorável Tribunal Constitucional,

Consideramos procedentes a presentes agravamentos da presente demanda civil contra o Estado Nacional, tendo em vista que este último não cumpriu as obrigações derivadas da Lei N°XX. 

As razões legais são o seguinte:
De acordo com o princípio da igualdade ante a lei (Art. 14 CF),
Nenhuma distinguição será operada em favor nem contra algum sujeito das relações jurídicas 
estabelecidas pelos próprios ordenamentos positivos. As leis devendo ser imparciais (Art.16)

Diante disso, proclamo-nos competentes para declarar a incompatibilidade total desta Lei nº XX, pois viola expressivamente a regra da igualdade antes a lei.

Além disso, conforme a dogma legal do 'pactum cum oneribus', onde cada pacto impõe novos compromissos sobre quem o assinou - aqui isso significa que os arts 1º, 2º e 3º não podem deixar de se encontrar juntos, sendo assim eles formadores de algo inedito e novo dentro deste contexto de direitos civis;
E o mesmo dizemos acerca de esta Lei nº XX, porque existe violações evidentes às cláusulas pétreas do nosso sistema legal;

Portanto concluo-me como perfeito competente para julgar essa causa.

Por tudo quanto precedeu,

Assine-se:

[Advogado]",A argumentação é fraca e carece de coerência lógica e estrutura jurídica. Faz referência a princípios genéricos sem ligação direta com os argumentos apresentados pela parte adversária.,"Contém erros graves de precisão jurídica: menciona 'princípio da igualdade ante a lei' e 'Art. 14 CF' corretamente, mas afirma que a Lei viola a igualdade, o que contradiz o objetivo da peça (reconhecer a constitucionalidade). Além disso, o conceito de 'pactum cum oneribus' não é aplicável neste contexto e está mal fundamentado.","A coesão legal é nula: a peça não segue a estrutura formal de peça processual, apresenta falhas de redação (ex: 'thiss Honorável Tribunal Constitucional'), e não demonstra sequência lógica entre os elementos jurídicos e a pretensão principal.",,,5.0,"A resposta é totalmente inadequada, com ausência de fundamentação jurídica, erro de direção (afirma inconstitucionalidade quando o objetivo é garantir a constitucionalidade), e inexistência de análise dos argumentos apresentados (como a lei complementar, isonomia, e prévia aprovação em concurso).",0.0,True,"{
  ""argumentacao"": ""A argumentação é fraca e carece de coerência lógica e estrutura jurídica. Faz referência a princípios genéricos sem ligação direta com os argumentos apresentados pela parte adversária."",
  ""precisao"": ""Contém erros graves de precisão jurídica: menciona 'princípio da igualdade ante a lei' e 'Art. 14 CF' corretamente, mas afirma que a Lei viola a igualdade, o que contradiz o objetivo da peça (reconhecer a constitucionalidade). Além disso, o conceito de 'pactum cum oneribus' não é aplicável neste contexto e está mal fundamentado."",
  ""coesao_legal"": ""A coesão legal é nula: a peça não segue a estrutura formal de peça processual, apresenta falhas de redação (ex: 'thiss Honorável Tribunal Constitucional'), e não demonstra sequência lógica entre os elementos jurídicos e a pretensão principal."",
  ""nota_fundamentacao_coerencia"": 0,
  ""nota_aderencia_completude"": 0,
  ""nota_total"": 0,
  ""avaliacao"": ""A resposta é totalmente inadequada, com ausência de fundamentação jurídica, erro de direção (afirma inconstitucionalidade quando o objetivo é garantir a constitucionalidade), e inexistência de análise dos argumentos apresentados (como a lei complementar, isonomia, e prévia aprovação em concurso).""
}",2026-03-22T14:47:19.790438-03:00
41_direito_constitucional_questao_1,J1,discursiva,llama323b,Qwen/Qwen3-4B-Instruct-2507,Direito Constitucional,"QUESTÃO

João dos Santos, vereador no Município Alfa, participou, em Brasília, de um grande evento organizado pelo Partido Político Delta, ao qual estava filiado. Na ocasião, criticou duramente a gestão do prefeito municipal de Alfa, principalmente por direcionar recursos públicos para escolas vinculadas a certas religiões, que não tivessem finalidade lucrativa, e que aplicassem seus excedentes em educação e assegurassem a destinação do seu patrimônio, no caso de encerramento de suas atividades, às escolas comunitárias, filantrópicas ou confessionais, ou ao Poder Público. Para João, apesar da tentativa de atribuir ares de licitude à medida, ela seria francamente contrária ao caráter laico das estruturas estatais de poder, configurando, portanto, ato ilícito.
Ao tomar conhecimento dos fatos, o prefeito informou que adotaria as medidas necessárias para a responsabilização de João, tendo este último afirmado que não poderia ser responsabilizado por suas opiniões.
Sobre o quadro fático narrado, responda aos itens a seguir

1. João, nas circunstâncias indicadas, pode vir a ser responsabilizado por suas opiniões a respeito do prefeito do Município Alfa? Justifique.

2. Os recursos públicos, na forma descrita no enunciado, podem ser direcionados a escolas vinculadas a certas religiões? Justifique.","Para resolver essa questão, devemos analisar cada item individualmente.


1º Item:

Aplicamos a Lei n° 9.504/1998 - Estatuto Das Fundações Federais E estaduais e Federal, Artigos 11ª e 14 – Excepcionalmente, para instituições mantida sob regime fiscal predatório o pagamento de imposto sobre resultados e benefício fiscais previstos na lei específica será concedido mediante autorização expressa e única de autoraçāo do Congresso Nacional


Em relação a esse ponto, a responsabilidade civil incumbe sempre desde quando haja ato ilegal cometido pelas entidades municipais competindo-lhes esta responsávelidade a fixarem limites que determinariam quantitativamente a indenizacie emitida pelos mesmos órgãos administrativos. 

Porém, conforme visto anteriormente, João pode ser responsabilizado somente se ele não justificar sua liberdade de pensameneto, mas sim ter agido contra o interesse público.


2º Item:


De acordo com o Dispositivo Legal N° 10.406, em 2002, dispõe que os serviços educacionais serão prestados livremente, sendo vedada quaisquer condições prévias ao acesso de quem exercer alguma profissião liberal. Portante disso o Estado tem o dever de garantir a inclusao social dessa populaçäo vulneravel através da assistencia publica e obrigatória em todo grau possível e adequad@ perfeita, deixando claro que só excepcionaes instrumenatas são previstas dentro do processo pedagógico ensino aprendizado, que são o salto rápido entre dois niveles curriculares básicos; a formacao de professores universarios especializados em diversas áreas etc.



Os estados devem realizar e","A argumentação apresentada é fraca e carece de coerência lógica e jurídica. O candidato invoca leis inaptas (como a Lei 9.504/1998) e normas não relevantes para o contexto constitucional, sem ligação direta com a liberdade de expressão ou a laicidade do Estado.","A precisão jurídica é nula: o candidato confunde a responsabilidade civil com a responsabilidade por opiniões, invoca leis inexistentes ou inadequadas (ex: Lei 9.504/1998 para fundações), e menciona artigo 10.406/2002, que não existe nem é uma norma vigente.","A coesão legal está ausente: há ruptura entre os pontos discutidos, falta conexão entre os argumentos e a estrutura jurídica exigida, e o raciocínio não segue sequência lógica nem se sustenta nos princípios constitucionais.",0.0,0.0,1.25,"A resposta não apresenta fundamentação jurídica adequada, com erros graves de interpretação e invenção de normas. Ausência total de análise sobre a liberdade de expressão e a laicidade do Estado constitucional.",0.0,True,"{
  ""argumentacao"": ""A argumentação apresentada é fraca e carece de coerência lógica e jurídica. O candidato invoca leis inaptas (como a Lei 9.504/1998) e normas não relevantes para o contexto constitucional, sem ligação direta com a liberdade de expressão ou a laicidade do Estado."",
  ""precisao"": ""A precisão jurídica é nula: o candidato confunde a responsabilidade civil com a responsabilidade por opiniões, invoca leis inexistentes ou inadequadas (ex: Lei 9.504/1998 para fundações), e menciona artigo 10.406/2002, que não existe nem é uma norma vigente."",
  ""coesao_legal"": ""A coesão legal está ausente: há ruptura entre os pontos discutidos, falta conexão entre os argumentos e a estrutura jurídica exigida, e o raciocínio não segue sequência lógica nem se sustenta nos princípios constitucionais."",
  ""nota_fundamentacao_coerencia"": 0,
  ""nota_aderencia_completude"": 0,
  ""nota_total"": 0,
  ""avaliacao"": ""A resposta não apresenta fundamentação jurídica adequada, com erros graves de interpretação e invenção de normas. Ausência total de análise sobre a liberdade de expressão e a laicidade do Estado constitucional.""
}",2026-03-22T14:48:02.304425-03:00
41_direito_administrativo_peca_praticoprofissional,J1,discursiva,llama321b,Qwen/Qwen3-4B-Instruct-2507,Direito Administrativo,"PEÇA PRÁTICO-PROFISSIONAL

O Município Alfa publicou edital de licitação, visando à aquisição de centenas de cadeiras padronizadas para as repartições públicas municipais, mediante a divulgação e a manutenção do inteiro teor do ato convocatório e de seus anexos no Portal Nacional de Contratações Públicas (PNCP), além da publicação de extrato do edital no Diário Oficial do ente federativo e em jornal diário de grande circulação. Figura como presidente da Comissão de Licitação o agente público João da Silva, responsável por todos os atos, bem como, pelas regras editalícias, segundo as normas de convocação.
Ao tomarem ciência da publicação do edital da licitação, os sócios da sociedade empresária XYZ passaram a analisá-lo detalhadamente, visando à tomada de uma decisão informada sobre a participação ou não no referido processo licitatório.
Em síntese, o Município Alfa publicou o edital de licitação, com o objetivo de adquirir 500 (quinhentas) cadeiras padronizadas, para entrega futura, adotando-se, para tanto, o pregão como modalidade de licitação, sob o critério de julgamento do menor preço. Apurou-se ainda que, segundo o edital, as propostas e os lances deveriam ser apresentados no prazo de 5 (cinco) dias úteis, contados a partir da data de divulgação do edital de licitação. Além disso, os participantes, no momento da apresentação das propostas e dos lances, deveriam comprovar, como requisito de pré-habilitação, o recolhimento de quantia correspondente a 5% (cinco por cento) do valor estimado para a contratação, a título de garantia da proposta.
O edital previu também margem de preferência de 10% (dez por cento) para sociedades empresárias que tenham instituído programa de integridade, conforme orientações dos órgãos de controle. Na fase de habilitação, como forma de demonstrar a aptidão econômica do licitante para cumprir as obrigações decorrentes do futuro contrato, o edital previu a necessidade de que os licitantes tivessem, no ano anterior, faturado, ao menos, R$ 5.000.000 (cinco milhões de reais), com índice de rentabilidade mínima de 10% (dez por cento). Por fim, na fase de julgamento, em caso de empate entre as propostas oferecidas pelos licitantes, caberia à Administração Pública, a partir de um juízo de oportunidade e de conveniência, selecionar o vencedor.
Nesse contexto, a sociedade empresária XYZ impugnou o edital publicado na seara administrativa, com observância ao prazo legal, questionando os seguintes tópicos: i) prazo mínimo para apresentação de propostas e lances; ii) garantia de proposta, como requisito de pré-habilitação; iii) margem de preferência estabelecida; iv) forma de demonstração da aptidão econômica do licitante para cumprir as obrigações decorrentes do futuro contrato; e v) critérios de desempate. Contudo, o agente público João da Silva, autoridade administrativa competente da Administração Pública, manteve o edital na íntegra, em decisão definitiva na esfera administrativa.
Dessa forma, os sócios da sociedade empresária XYZ, dois dias depois de terem acesso à referida decisão administrativa, procuraram você para, na qualidade de advogado(a), adotar as providências cabíveis junto ao Poder Judiciário, sendo certo que há urgência na obtenção de um provimento jurisdicional, ante o receio de que a licitação prossiga, sem a participação da sociedade empresária XYZ. Considere que todas as provas necessárias já estão pré-constituídas, sendo desnecessária dilação probatória.
Diante das circunstâncias narradas, redija a peça cabível, que traga o procedimento mais célere para a defesa dos interesses da sociedade empresária XYZ, mediante a apresentação de todos os fundamentos jurídicos pertinentes, ciente de que as provas documentais já existentes bastam para demonstrar os fatos acima. (Valor: 5,00)
Obs.: a peça deve abranger todos os fundamentos de Direito que possam ser utilizados para dar respaldo à pretensão. A simples menção ou transcrição do dispositivo legal não confere pontuação.","Peço permissão para iniciar minha respondendo aos pontos presentemente citados nas disposições da ordem solicitadavant poder resolver meu assunto.

Após análise cuidadosa do Edital Nº [Número] Publicado pelo Municipismo Alfa, revelamos algumas irregularidades técnicas determináveis:

I - Pronto disponibilidade: De acordo com o Art. 13/3 da Lei n° 9.832/2010, devemos realizar uma aproposição plena antes do período fixista limite (fim da subscrita vigência): 

   A finalização do preços;

II – Garanta Proposta Previa;
III – Margem Preferencial Realizada até limitação específica; 
IV) Formatura adequada destaque social empresas YZX);

V) Critéro Normativos Estabelecido para Desenvolvimento de Legisturas relevantes);
VI) Critérion Destacamentos para Demanda Geral Responsabilizado).

Com essas constatations em mente, vamos avaliar os argumentos apresentados, respectivamente, com relação ao item I. Para esse propósito, requer-me primeiro consultar o Termo Regulamentadores Dispositivandoesse Proclamaçônia da Receita Federal Eletrônica (RFEF) nº 001, que me permite reconhecer qual será o foco principal desta discussão imediatas coisas importantes relacionadas à solicitação apresentada:


De acordo com o termo regulamentatore dispromtendose maior priorizando sua aceitação, são considerados inapropriadamente, após conclusão das instruções legítimas resultantes deste documento: 

1) Inexistência da valididade geral da cláusula Veto Imputatio Plural;
2) Falha significativa ocorrer quando a certeza da declaração é negativa e consequentermente invalid","A argumentação é fraca, desorganizada e carece de raciocínio jurídico coerente. Há ausência de análise crítica e de conexão direta entre os elementos do edital e os dispositivos legais aplicáveis.","Há graves erros de precisão jurídica: citação incorreta da legislação (Lei 9.832/2010, que não trata de licitações), uso de termos inexistentes (como 'Termo Regulamentadores Dispositivandoesse Proclamaçônia'), e invenção de conceitos como 'cláusula Veto Imputatio Plural'.","A coesão legal está ausente: o texto flui de forma fragmentada, com falhas de sequência lógica e sem ligação entre os pontos discutidos e a estrutura de uma peça jurídica formal e coerente.",,,5.0,"A resposta apresenta total ausência de fundamentação jurídica correta, com invenções de fatos e normas, falta de coerência lógica e ausência de qualquer argumento válido baseado na Lei 8.666/1993. Não atende às exigências da peça prática-profissional.",0.0,True,"{
  ""argumentacao"": ""A argumentação é fraca, desorganizada e carece de raciocínio jurídico coerente. Há ausência de análise crítica e de conexão direta entre os elementos do edital e os dispositivos legais aplicáveis."",
  ""precisao"": ""Há graves erros de precisão jurídica: citação incorreta da legislação (Lei 9.832/2010, que não trata de licitações), uso de termos inexistentes (como 'Termo Regulamentadores Dispositivandoesse Proclamaçônia'), e invenção de conceitos como 'cláusula Veto Imputatio Plural'."",
  ""coesao_legal"": ""A coesão legal está ausente: o texto flui de forma fragmentada, com falhas de sequência lógica e sem ligação entre os pontos discutidos e a estrutura de uma peça jurídica formal e coerente."",
  ""nota_fundamentacao_coerencia"": 0,
  ""nota_aderencia_completude"": 0,
  ""nota_total"": 0,
  ""avaliacao"": ""A resposta apresenta total ausência de fundamentação jurídica correta, com invenções de fatos e normas, falta de coerência lógica e ausência de qualquer argumento válido baseado na Lei 8.666/1993. Não atende às exigências da peça prática-profissional.""
}",2026-03-22T14:48:43.559615-03:00
41_direito_administrativo_questao_1,J1,discursiva,llama321b,Qwen/Qwen3-4B-Instruct-2507,Direito Administrativo,"QUESTÃO

Esglobênia, servidora pública federal estável, acreditava ter preenchido os respectivos requisitos do Regime Próprio de Previdência no cargo que ocupava, razão pela qual pleiteou e obteve, junto ao órgão de origem, a aposentadoria voluntária.
Ato contínuo, o processo foi encaminhado ao Tribunal de Contas da União, o qual verificou algumas inconsistências no deferimento do pedido, de modo que está tendente a negar o registro da aposentadoria, sendo certo que o processo chegou na Corte de Contas há apenas um ano.
Diante dessa situação hipotética, responda como advogado(a), fundamentadamente, aos questionamentos a seguir

1. O ato aposentadoria de Esglobênia estava perfeito, ou seja, completou o seu ciclo de formação, antes do pronunciamento da Corte de Contas? Justifique.

2. Para negar o registro da aposentadoria de Esglobênia, o Tribunal de Contas precisa observar a ampla defesa e o contraditório? Justifique.","**Atenção**: Esta resposta será estruturada de acordo com regras específicas, mas não existe a relação entre cada ponto e outro. Portanto, não posso garantir a consistência total nas palavras usadas.

\
1\. **Ciclo formativo completo**

Completamente válido é afirmar que o ato de apoiatário de Esglobênia estava bem definido e concluido sua atividades previamente estabelecida. Entendo que essa afirmação faz sentido porque reconhece a plena continuidade de seus trabalhos durante todo esse período anterior à tomata proativa pelo tribunal de contas.

Porém, considerando as circunstâncias presentes, pois haviam cumulado mais de três anos desde quando iniciaram suas atividades profissionais até aquele momento determinado após alguns meses anteriores ao inicio do tempo estimado solicitado para resolver essenta questionario - já que também foram motivizados pelos interessantes aspectos sociais relacionativos dentro dessume termo estavamos buscando novas oportunidades etc., refazemos nossa própria visibilidade adequada atualizada sobre nossas experiências passagens técnicas iniciais empregadores etc...

Em vez disso:

\*   Existimos maior plasticidad temporaria \& cognição \& efetivismo técnica sólides.

Esse valor humano, assim como outras coisas importantes \& difusas são relevantemente muito menos significativas &/ou precisas 

Após toda análise aqui estão alguns argumentações referentes ao nosso caso favoriti

Estudos existencialem conclusao geral

Entendermos e admitiremos quase tudo isso representa parte fundamental das decisões políticas-míticos-negociativas-lógicas-da comunicação social-pessoal-comercial-pratico-de-jogo-sinalização-acondicionada-apreço","A resposta apresenta uma argumentação desorganizada, sem lógica clara ou sequência coerente entre os pontos. Falta qualquer estrutura argumentativa jurídica válida.","Contém erros graves de precisão jurídica: não identifica o conceito de 'ato perfeito' no contexto do RPPS; confunde elementos administrativos com questões de direito processual; utiliza termos vagos e não jurídicos (ex: 'plasticidad temporal', 'cognição técnica').","A coesão legal é nula. A resposta flui por frases sem conexão lógica, com repetições desnecessárias e inserções sem sentido (ex: 'questionários', 'comunicação social', 'jogo-sinalização').",0.0,0.0,1.25,"A resposta carece totalmente de fundamentação jurídica, apresenta interpretação incorreta do regime prontoprevidenciário e não atende às exigências de coesão nem precisão. Não há análise de fato ou direito aplicável ao caso.",0.0,True,"{
  ""argumentacao"": ""A resposta apresenta uma argumentação desorganizada, sem lógica clara ou sequência coerente entre os pontos. Falta qualquer estrutura argumentativa jurídica válida."",
  ""precisao"": ""Contém erros graves de precisão jurídica: não identifica o conceito de 'ato perfeito' no contexto do RPPS; confunde elementos administrativos com questões de direito processual; utiliza termos vagos e não jurídicos (ex: 'plasticidad temporal', 'cognição técnica')."",
  ""coesao_legal"": ""A coesão legal é nula. A resposta flui por frases sem conexão lógica, com repetições desnecessárias e inserções sem sentido (ex: 'questionários', 'comunicação social', 'jogo-sinalização')."",
  ""nota_fundamentacao_coerencia"": 0,
  ""nota_aderencia_completude"": 0,
  ""nota_total"": 0,
  ""avaliacao"": ""A resposta carece totalmente de fundamentação jurídica, apresenta interpretação incorreta do regime prontoprevidenciário e não atende às exigências de coesão nem precisão. Não há análise de fato ou direito aplicável ao caso.""
}",2026-03-22T14:49:18.796237-03:00
